ball,score,commentary,second_commentary
9.4,•,"Dagar to Mitchell, no run no run Keeps it quicker and on a length on middle. Mitchell can only mistime it back towards the bowler","Mayank Dagar to Mitchell, no run, flatter delivery on middle, knocked back towards the bowler who hops to his right to stop it"
9.3,•,"Dagar to Mitchell, no run no run Flatter on middle stump, he defends","Mayank Dagar to Mitchell, no run, full on off-stump, driven straight back to the bowler"
9.2,1,"Dagar to Rahane,  1 run 1 run Shimmies down the track and outside the line of leg stump, giving himself some room. Dagar adjust his length as Rahane drives to long off","Mayank Dagar to Rahane, 1 run, full and just outside off, Rahane makes room and skips down the track before slapping it down to long-off"
9.1,1,"Dagar to Mitchell,  1 run 1 run On a length on middle and leg, he brings out the sweep past short fine leg","Mayank Dagar to Mitchell, 1 run, full on off-stump, Mitchell leans right across his stumps and fetches it with a sweep, gets it to the left of short fine-leg but there's protection in the deep"
8.6,1,"Karn to Mitchell,  1 run 1 run Very full once more on the stumps, he eases it to long on","Karn Sharma to Mitchell, 1 run, full on middle, pushed down the ground to long on, good over for CSK, 15 off it"
8.5,1,"Karn to Rahane,  1 run 1 run A touch fuller on the stump, he pushes towards long-on. Was looking for a second but the fielder is quick on the ball","Karn Sharma to Rahane, 1 run, tossed up full on middle, gently worked away towards wide mid-on, only went to the edge of the ring and Rahane was looking for two but the man running in from long-on was quick"
8.4,1,"Karn to Mitchell,  1 run 1 run Dragged down on middle and leg, as Mitchell hangs back and works it to the on-side","Karn Sharma to Mitchell, 1 run, length delivery on middle, Mitchell covers his stumps and works it away towards mid-wicket for one, good cricket"
8.3,6,"Karn to Mitchell,  SIX runs SIX runs This time over long off! Floated slower outside off, he goes over long off now. Such clean striking. Free swing of the blade from Mitchell","Karn Sharma to Mitchell, SIX, two in a row! Tossed up full outside off, more than enough room for Mitchell to free his arms this time and he launches it over long-off, Karn Sharma under pressure"
8.2,6,"Karn to Mitchell,  SIX runs SIX runs Finally connect at one! Tossed up just a touch but that was right in Mitchell's arc. He extends his arm and swings it miles over long on","Karn Sharma to Mitchell, SIX, Mitchell goes big! Floated up full on off-stump, this was in his zone and he cleared his front-leg and mowed it straight down the ground, cleared the ropes so easily"
8.1,•,"Karn to Mitchell, no run no run Darted quicker on off stump, he prods half-forward and pushes to cover","Karn Sharma to Mitchell, no run, tossed up full on off-stump, Mitchell prods forward and knocks it towards cover"
7.6,•,"Dagar to Rahane, no run no run Pushes the length ball quicker on leg stump, Rahane goes back looking for a flick but misses and is rapped on the pad with the ball going down leg","Mayank Dagar to Rahane, no run, fired in quicker on a length, angles into the pads and skids through this time, beats Rahane who was looking to turn it into the leg-side and hits his pad, would've gone down leg"
7.5,1,"Dagar to Mitchell,  1 run 1 run A touch quicker outside off, he pushes to Faf at cover who flicks in back-handed flick. But Rahane was in","Mayank Dagar to Mitchell, 1 run, flatter delivery outside off, Mitchell shuffles across his stumps early and knocks it towards cover for a quick single, even a quick pick-up and throw from Faf can't find Rahane short"
7.4,•,"Dagar to Mitchell, no run no run Ooh, some turn outside off. Mitchell is camped on the backfoot and defends towards cover","Mayank Dagar to Mitchell, no run, shade fuller and just outside off, Mitchell plays back again as he knocks it towards cover, bit of bite and turn again"
7.3,•,"Dagar to Mitchell, no run no run Shimmies down the track but Dagar shortens the length and Mitchell has to defend","Mayank Dagar to Mitchell, no run, length delivery on off-stump, saw the batter running down the track and dropped it just a touch shorter, just holds in the surface a touch too"
7.2,•,"Dagar to Mitchell, no run no run A tad short just outside off, he stays back and eases to backward point","Mayank Dagar to Mitchell, no run, length delivery outside off, punched straight to point"
7.1,1,"Dagar to Rahane,  1 run 1 run Length outside off, he pushes it through point for a run","Mayank Dagar to Rahane, 1 run, full outside off, just a touch early through his drive but it goes into the gap and through to sweeper cover"
6.6,W,"Karn to Ravindra, OUT OUT He's gone now! One shot too many for Rachin. Was a length ball on middle and leg. He sweeps eyeing another six, but doesn't connect as cleanly. Deep backward square leg settles himself and takes a comfortable catch. Lovely debut for Rachin who falls for a 15-ball 37. See all photos","Karn Sharma to Ravindra, out Caught by Rajat Patidar!! Karn has his man now - was pushed through quicker and at the stumps, Ravindra went down on his knee as he looked to play the slog-sweep - hit it hard and hit it flat, straight down Patidar's throat at deep backward square leg. The dangerous Ravindra departs and RCB can heave a sigh of relief. Ravindra c Rajat Patidar b Karn Sharma 37(15) [4s-3 6s-3]"
6.5,6,"Karn to Ravindra,  SIX runs SIX runs Dropped short and he pumps it for six! On off stump, he rocks back and hammers him over deep midwicket fielder's head.","Karn Sharma to Ravindra, SIX, a long hop and it's been hammered - dragged half-way by Karn, Ravindra rocks back and then thumps it powerfully over wide mid-wicket, there's a fielder in the deep, but he's well away from the ball"
6.4,1,"Karn to Rahane,  1 run 1 run Shimmies down the track to the length ball on leg stump and pushes to long on","Karn Sharma to Rahane, 1 run, Karn dragged the length back as Rahane came down the pitch, worked down to long-on for a single"
6.3,•,"Karn to Rahane, no run no run Flatter outside off, he stays back and punches to backward point","Karn Sharma to Rahane, no run, pushed through by Karn - Rahane backs away and finds backward point with the cut"
6.2,2,"Karn to Rahane,  2 runs 2 runs Fuller in length on off and middle, he flicks it to deep midwicket and some excellent running get them a couple of runs","Karn Sharma to Rahane, 2 runs, loopy delivery on middle and leg, clipped in front of square on the on-side and they race back for the second"
6.1,•,"Karn to Rahane, no run no run Flatter on the stumps, he goes back and pushes to the on side and Karn gets across","Karn Sharma to Rahane, no run, flighted delivery on middle and leg, worked off the back-foot to the bowler"
5.6,3,"Yash Dayal to Rahane,  3 runs 3 runs Fuller outside off, he digs it to backward point and sets off. The fielder throws down the stumps at the non-striker end, but Rahane is in. Also gets two extra runs via the ricochet","Yash Dayal to Rahane, 3 runs, more runs, this is so frustrating for RCB - yorker length delivery and it was jammed in front of cover-point, the run was always there, but the fielder has a shy at the bowler's end, no one's backing him up and Rahane gets a couple of more runs in the bargain"
5.5,2,"Yash Dayal to Rahane,  2 runs 2 runs Juuuuust over Faf's head! Length ball outside off. He was looking  to go up and over mid-off, doesn't connect as well. Faf runs back, but can't get a hand on it","Yash Dayal to Rahane, 2 runs, a mistimed drive, but the ball drops over Faf's right shoulder - fuller length delivery and just outside off, Rahane went hard on the drive, came off the thick edge and he's lucky to have cleared the infield"
5.4,2,"Yash Dayal to Rahane,  2 runs 2 runs Fuller in length well outside off. He opens his arms and drives aerially to the right of deep point","Yash Dayal to Rahane, 2 runs, fuller length delivery and well wide of off - Rahane plays with a bent knee as he slices the drive over backward point, comes back for the second"
5.3,6,"Yash Dayal to Rahane,  SIX runs SIX runs Stand and deliver! Shot of the evening so far, for me. Back of a length ball outside off. He stands still and pumps him over mid-off and eventually the ropes for a 84m six","Yash Dayal to Rahane, SIX, Rahane throws his hands on a length ball and sends it carving over mid-off for a maximum - back of a length and angling across the right-hander, he's smote it on the rise and the timing is sublime, into the stands at long-off"
5.2,•,"Yash Dayal to Rahane, no run no run Very full and outside off, Rahane tries to squirt this fine. Makes no connection once more","Yash Dayal to Rahane, no run, fuller length delivery and shaping across the right-hander - Rahane was looking to jam it out and missed"
5.1,•,"Yash Dayal to Rahane, no run no run Lovely bowling again from Dayal. Gets this on  a length angling away from Rahane, who is on the move while looking for a drive. Gets beaten.","Yash Dayal to Rahane, no run, Dayal is bowling beautifrully to the right-handers, pitched up and the angle takes the ball away from Rahane's rteach, past the waft and into the gloves of the keeper"
4.6,•,"Alzarri Joseph to Ravindra, no run no run Raps him in the midriff at pace. Back of a length again on middle. Rachin looks to hack that away, but is beaten for pace","Alzarri Joseph to Ravindra, no run, short of a good length and around the off-stump channel, Ravindra swings and is struck high on the body"
4.5,2,"Alzarri Joseph to Ravindra,  2 runs 2 runs Just short of Faf at mid-off. Was a back of a length ball outside off, he stands tall and slaps it hard but aerially. Faf dives forward, but the ball clearly fell short","Alzarri Joseph to Ravindra, 2 runs, just short of Faf at mid-off, and he then has to chase, does well to keep them down to a couple - back of a length and well wide of off, flat-batted uppishly towards mid-off and had faf diving forward on the catch"
4.5,2,"Alzarri Joseph to Ravindra,  2 runs 2 runs Just short of Faf at mid-off. Was a back of a length ball outside off, he stands tall and slaps it hard but aerially. Faf dives forward, but the ball clearly fell short","Alzarri Joseph to Ravindra, wide, short and down leg, Ravindra was looking to help it on its way with the pull and missed, called as a wide"
4.5,1w,"Alzarri Joseph to Ravindra, 1 wide 1 wide Back of a length ball down leg. He looks to help it away, can't connect but gets a wide. Rawat does well to his right","Alzarri Joseph to Ravindra, 2 runs, just short of Faf at mid-off, and he then has to chase, does well to keep them down to a couple - back of a length and well wide of off, flat-batted uppishly towards mid-off and had faf diving forward on the catch"
4.5,1w,"Alzarri Joseph to Ravindra, 1 wide 1 wide Back of a length ball down leg. He looks to help it away, can't connect but gets a wide. Rawat does well to his right","Alzarri Joseph to Ravindra, wide, short and down leg, Ravindra was looking to help it on its way with the pull and missed, called as a wide"
4.4,1,"Alzarri Joseph to Rahane,  1 run 1 run Back of a length ball outside off, he pats it to deep third","Alzarri Joseph to Rahane, 1 run, back of a length and just outside off, Rahane runs it down towards third man for a single"
4.3,•,"Alzarri Joseph to Rahane, no run no run Big shout for lbw but the umpire stays unmoved. No review taken. Length ball at 146kph that strikes Rahane on the pad. Think he got an inside-edge back onto the pad.","Alzarri Joseph to Rahane, no run, a long LBW appeal, but they ain't reviewing it, must've been an inside edge, too close to dab and Rahane squeezed an under-edge onto his front-pad"
4.2,1,"Alzarri Joseph to Ravindra,  1 run 1 run Length on off stump, he stays leg side of the ball and pushes to cover and sets off","Alzarri Joseph to Ravindra, 1 run, Alzarri shortens the length around off, punched to the left of cover-point for a single"
4.1,6,"Alzarri Joseph to Ravindra,  SIX runs SIX runs Hello there Mr Joseph says Rachin as he pulls him for six! Banged in short and on his hips, he helps it over fine leg with ease","Alzarri Joseph to Ravindra, SIX, cracking shot, pacy short ball from Alzarri - but this is at the hips of Ravindra, he swivels across anmd then hammers the pull over long leg for a maximum"
3.6,W,"Yash Dayal to Gaikwad, OUT OUT Edged and taken on the second attempt by Green at first slip. This is excellent bowling and also excellent captaincy from Faf to keep the slip in. Keeps it on a length but well outside off stump. Gaikwad gets forward reaching for the drive. He gets a thick edge and Green takes a fairly simple catch albeit on the second attempt. Important wicket for RCB See all photos","Yash Dayal to Gaikwad, out Caught by Green!! Edged and caught! Green on the second attempt and he has big hands, this is some reward for Dayal - troubled Gaikwad with the angle and has finally nailed him - pitched up and pushed across with the angle, Gaikwad had to reach out on the drive, there's no control over the shot and gets a thick edge to slip's right. Green was quick to react, but the ball popped out, fortunately for RCB - he's alert enough to grab the rebound off the knee. Gaikwad c Green b Yash Dayal 15(15) [4s-3]"
3.5,4,"Yash Dayal to Gaikwad, FOUR runs FOUR runs Strayed on the pads and Gaikwad cashes in. Length down leg, he shuffles across and clips fine and for four. Six fours and six already in this innings","Yash Dayal to Gaikwad, FOUR, wrong line from Dayal, short and at the pads - Gaikwad gets inside the line and nudged it very fine, beats the man in the ring and runs away"
3.4,1,"Yash Dayal to Ravindra,  1 run 1 run He's timing these really well so far. That was on a good length outside off, he stands tall and slaps it to mid-off","Yash Dayal to Ravindra, 1 run, on a good length and just outside off, driven to the right of mid-off for a single"
3.3,•,"Yash Dayal to Ravindra, no run no run A hint of shape away from Dayal on that length ball outside off, he prods forward and punches it nicely but straight to cover point","Yash Dayal to Ravindra, no run, fuller length delivery outside off, Ravindra leans across and defends it with an open face to cover-point"
3.2,4,"Yash Dayal to Ravindra, FOUR runs FOUR runs SHOT! Fuller-length ball but was veering down leg. He flicks it with authority past short fine leg","Yash Dayal to Ravindra, FOUR, more runs, too full and too straight from Dayal - on the pads and it's whipped away backward of square on the on-side, beats the man in the ring and races away"
3.1,1,"Yash Dayal to Gaikwad,  1 run 1 run Length ball angling away from Gaikwad outside off. He pushes at it with an open face of the bat to deep third","Yash Dayal to Gaikwad, 1 run, fuller length delivery outside off, Gaikwad plays with an angled bat and runs it backward of square on the off-side for a single"
2.6,6,"Siraj to Ravindra,  SIX runs SIX runs Top edge for six! Rachin is enjoying a bit of luck on IPL debut. A well-directed short of a length ball aimed at his body. Rachin swivel-pulls gets a big top edge that goes over short fine leg and just over the ropes","Siraj to Ravindra, SIX, top-edge and six, luck running Ravindra's way at the moment - banged in short and he's late on the pull, gets a massive top-edge, was always a safe shot with fine leg inside the ring, this one has enough power to sail over the ropes"
2.5,1,"Siraj to Gaikwad,  1 run 1 run back of a length ball outside off, he gets across and slaps it to deep point","Siraj to Gaikwad, 1 run, short of a good length and well wide of off, chopped to the left of cover-point for a single"
2.4,1,"Siraj to Ravindra,  1 run 1 run Fuller in length on middle and leg, he punches it neatly but straight to mid-on","Siraj to Ravindra, 1 run, fuller length delivery on the stumps, driven to the left of mid-on and they're off for a quick single"
2.3,1,"Siraj to Gaikwad,  1 run 1 run Another excellent stop from Dagar. This time at cover. Was fuller in length outside off, he leans into the cover drive but Dagar dives full-length to his right to save three","Siraj to Gaikwad, 1 run, Mayank has saved a few more runs here - fuller length delivery and well wide of off, driven to the right of cover where he threw himself and made a one-handed save"
2.2,1,"Siraj to Ravindra,  1 run 1 run Chipped just over the bowler's head. Was a length ball on middle, he was looking to clip it but closed the face of the bat early. The leading edge just evades the bowler","Siraj to Ravindra, 1 run, Ravindra gets lucky now - on a good length and angling back into the left-hander, Ravindra was early into the tuck, closed the bat-face and the leading edghe popped over Siraj's outstretched right-hand"
2.1,4,"Siraj to Ravindra, FOUR runs FOUR runs Flicked for four! That's a lovely wristy flick from Rachin. Was a length ball on his pads, he sends it all across the carpet and deep backward square leg can't do much","Siraj to Ravindra, FOUR, beautifully played, fuller length delivery and angling into the pads, Ravindra lets the ball come, brings his wrists into play and then flicks it backward of square on the on-side, beat the despairing dive from the fielder in the deep"
2.1,4,"Siraj to Ravindra, FOUR runs FOUR runs Flicked for four! That's a lovely wristy flick from Rachin. Was a length ball on his pads, he sends it all across the carpet and deep backward square leg can't do much","Siraj to Ravindra, wide, Siraj loses his line and spills one well down the leg-side, called as a wide"
2.1,1w,"Siraj to Ravindra, 1 wide 1 wide Full but sprays it down leg. Rawat does well to his right. Called a wide","Siraj to Ravindra, FOUR, beautifully played, fuller length delivery and angling into the pads, Ravindra lets the ball come, brings his wrists into play and then flicks it backward of square on the on-side, beat the despairing dive from the fielder in the deep"
2.1,1w,"Siraj to Ravindra, 1 wide 1 wide Full but sprays it down leg. Rawat does well to his right. Called a wide","Siraj to Ravindra, wide, Siraj loses his line and spills one well down the leg-side, called as a wide"
1.6,•,"Yash Dayal to Gaikwad, no run no run Goes past the outside edge for a third straight time. Changes the length again. Was back of a length outside off. Gaikwad throws his hands at it looking for a swish, gets beaten","Yash Dayal to Gaikwad, no run, beaten, short of a good length and angling across the right-hander, brings out a loose waft and Gaikwad's beaten on the outside edge"
1.5,•,"Yash Dayal to Gaikwad, no run no run And again! Pushes the fuller and angling away from Gaikwad inviting him for a drive. He takes the bait but only connects at thin air","Yash Dayal to Gaikwad, no run, much better from Yash - pitched up and pushed across with the natural angle, dragged Gaikwad into the drive and beats him on the outside edge"
1.4,•,"Yash Dayal to Gaikwad, no run no run Ooh, close. Good length ball outside off with a hint of away shape. Gaikwad nibbles at it and gets beaten","Yash Dayal to Gaikwad, no run, lovely delivery, short of a good length and a hint of shape away from off, Gaikwad has a poke at that and nearly edges it through to the keeper"
1.3,•,"Yash Dayal to Gaikwad, no run no run Fails to get a decent connection on that. Length ball on Gaikwad's pads, he gets across and clip but can't beat fine leg","Yash Dayal to Gaikwad, no run, back of a length and at the hips, tucked straight to the fielder at short fine"
1.2,1,"Yash Dayal to Ravindra,  1 run 1 run Fuller in length on middle and leg, he clips past mid-on for a run","Yash Dayal to Ravindra, 1 run, on a good length and angling into the left-hander, worked in front of square on the on-side, to the left of mid-on for a single"
1.1,4,"Yash Dayal to Ravindra, FOUR runs FOUR runs Gets an inside-edge for four! Beginners luck for Rachin. Was a length ball outside off, he looks to flay it away through the off side, gets a thick inside edge just past off stump and past the keeper's right","Yash Dayal to Ravindra, FOUR, streaky and four, fuller length delivery and holding its line outside off - Ravindra goes hard on the drive, gets a big inside edge that runs away past the stumps and away from Rawat's reach"
0.6,•,"Siraj to Gaikwad, no run no run Back of a length ball outside off. He plays inside the line of the ball and is beaten. Rawat is hit on the knee with the ball going to him on the half-volley","Siraj to Gaikwad, no run, on a good length and holding its line outside off - stayed very low and burst under Gaikwad's bat, bouncing through to the keepert"
0.5,4,"Siraj to Gaikwad, FOUR runs FOUR runs In the air but in the gap. That was close. Was a length ball floated well outside off. He opens the face of the blade and drives aerially between backward point and point. Picked the gap to perfection","Siraj to Gaikwad, FOUR, uppish and four, fuller length delivery and shaping away from wide of off, Gaikwad is lured into the drive, he doesn't get on top of the bounce, but does manage to find the gap square past cover-point"
0.4,•,"Siraj to Gaikwad, no run no run Length ball tailing away from Gaikwad well outside off. He leaves it alone","Siraj to Gaikwad, no run, on a good length and shaping away from outside off - Gaikwad covers the line, lifts his bat and lets it go"
0.3,•,"Siraj to Gaikwad, no run no run Lovely timing and even better fielding at backward point. Back of a length ball outside off. The width was the key. He cuts it hard but Dagar flings to his right and saves a certain four","Siraj to Gaikwad, no run, back of a length and well wide of off, punched to the right of backward point where Mayank Dagar makes an acrobatic stop, saved a certain boundary"
0.2,•,"Siraj to Gaikwad, no run no run Play and a miss now. Back of a length ball shaping away from Gaikwad, who has a swish at it but doesn't connect. Rawat collects on the bounce","Siraj to Gaikwad, no run, short of a good length and angling adcross the right-hander, stays a fraction low and goes under Gaikwad's poke, bounced through to the keeper"
0.1,4,"Siraj to Gaikwad, FOUR runs FOUR runs BANG! Short ball outside off, he swivels and pull over square leg with minimum of fuss. That's some way to start your IPL.","Siraj to Gaikwad, FOUR, cracking shot, Ruturaj is off and running - friendly short ball from Siraj, shoulders arms up to the right-hander, Gaikwad swivels across and then hammers the pull over square leg for a boundary"
