ball,score,commentary,second_commentary
19.6,6,"green to hardik ,  six runs six runs three in a row  upper-cut over deep-third  the full array from hardik  short and climbing outside-off and he uses the pace to loft it into the crowd ","green to hardik pandya , six , hat-trick of sixes to finish the innings  hardik has played a blinder here and he walks off delighted  green goes short and outside-off , there was deep backward-point in place but it didn't matter to hardik , he went for the upper-cut and beat the fielder easily  the last over from green was always going to be targeted and hardik ensured india made the most of it"
19.5,6,"green to hardik ,  six runs six runs lofted over long-off  sublime  silky  he was sitting back , gets a full ball in the slot and just checks a drive through the line and it sails over the rope","green to hardik pandya , six , this is why he denied the single  the confidence in hardik is just oozing at the moment  this is a tremendous shot  green misses the yorker length by a couple of inches and that is enough for hardik , he lofts it with minimal followthrough and the ball sails comfortably outside-off"
19.4,6,"green to hardik ,  six runs six runs leg-stump  leg-stump , he was sitting deep and waiting to smack it flat over the fence","green to hardik pandya , six , geez  that ball hardly took off  as flat a six as you'd see  slower ball dug into the wicket , hardik waits on the back foot with his front leg cleared and nails the pull well beyond deep-mid-wicket"
19.3,2,"green to hardik ,  2 runs 2 runs top edge flies over the bowler and lands safe  good bouncer , hurried him and he gets a thick top edge that lands at the bowler  mark as the men run in","green to hardik pandya , 2 runs , in the air and lands safely  short and rising , hardik moves across and tries to swat the leg-stump , the top-edge goes straight up and drops behind the bowler near mid-off , quick brace"
19.2,•,"green to hardik , no run no run length ball wide of off , 134kph , he miscues towards long-off","green to hardik pandya , no run , on a length and outside-off , hardik drills it to long-off and denies the single  he wants to face all the balls in this over and needs a change of bat  might have damaged it with this mistimed shot"
19.1,1,"green to harshal ,  1 run 1 run outside-off , 139kph , he drives to long-on","green to harshal patel , 1 run , outside-off , harshal drills it straight down and it is only a single"
18.6,4,"ellis to hardik , four runs four runs delightful late cut to bring up 50 off 25  short and wide , deep-point is on square , he let it come and placed it behind point with superb timing see all photos","nathan ellis to hardik pandya , four , fifty for hardik  his second in t20is and both have come since he made his return to the team  today the platform was set and he came and unleashed himself  this is a cracking shot to reach the landmark  off-pace and fraction short , hardik just delays the bat swing to ensure that the cut goes square and not close to the sweeper"
18.5,1,"ellis to harshal ,  1 run 1 run shorter slower ball , he miscues a pull-shot to long-on on the bounce","nathan ellis to harshal patel , 1 run , slower short of length delivery and harshal pulls it on the bounce to long-on"
18.4,1,"ellis to hardik ,  1 run 1 run good length , chopped into the off-side","nathan ellis to hardik pandya , 1 run , off-pace delivery , hardik chops it into the cover region and he takes the single"
18.3,1,"ellis to harshal ,  1 run 1 run magnificent save from maxwell at long-on  lofted powerfully to long-on , looks a certain six , maxwell leaps high over the rope , catches it in mid air , flicks it back , lands outside the rope without the ball but saves five runs  poetry in motion see all photos","nathan ellis to harshal patel , 1 run , brilliance by maxi  he  saved five runs for his team  slower ball and harshal picked it right out of the hand , lofts through the line and stands there admiring the shot , but maxi jumps high and catches it with both hands , releases the ball before he hits the ground beyond the rope"
18.2,4,"ellis to harshal , four runs four runs creamed through cover  a wide half volley and harshal climbs in first ball smashing it through the gap","nathan ellis to harshal patel , four , whoa  stand and deliver stuff  width outside-off and harshal dismisses the drive from his presence , he thumps it between extra-cover and mid-off  no need to run for that"
18.1,W,"ellis to karthik , out out huge lbw appeal turned down  australia review  full and straight , dk was trying to whip square  no bat involved  was it tailing past leg? he was very deep in the crease  ball tracking says out  three reds  smashing leg-stump  good review  ellis strikes again ","nathan ellis to karthik , out lbw   excellent review from ellis  he was the only one appealing , even wade was not convinced but ellis made finch go upstairs and they have got the big wicket  karthik gets caught in the crease and the skiddy good length ball beats everything , hits the front pad and then the back right in front of the stumps , ball-tracking shows it to be smashing leg-stump  karthik lbw b nathan ellis 6 5 "
17.6,2,"cummins to hardik ,  2 runs 2 runs length ball , outside-off , he smears a pull to deep midwicket and they run two on ellis' arm","cummins to hardik pandya , 2 runs , slower ball bowled into the surface , hardik pulls it in front of square and karthik races back for the second"
17.5,4,"cummins to hardik , four runs four runs lofted over mid off  a full toss outside-off , mid off is up , he chips this inside out with control to find the rope again see all photos","cummins to hardik pandya , four , another shot that  not off the middle but enough to trickle into the rope  low full toss and hardik miscues the loft over mid-off  very hard to get under these deliveries and hardik did well to get enough timing to clear smith inside the ring"
17.4,1,"cummins to karthik ,  1 run 1 run good , 138kph , middle and leg , he clips this to deep-square","cummins to karthik , 1 run , hard length from cummins and karthik clips it squarer this time , just a single to deep-square-leg"
17.3,2,"cummins to karthik ,  2 runs 2 runs good on off , 138kph , he  back to tuck this around the corner behind square for two","cummins to karthik , 2 runs , good on off , karthik tucks it behind square on the leg-side and scampers back for the second"
17.2,1,"cummins to hardik ,  1 run 1 run full and wide , he slices this off a thick-edge to wide deep-third","cummins to hardik pandya , 1 run , low full toss outside-off , hardik opens the bat face and slices it to deep backward-point"
17.1,6,"cummins to hardik ,  six runs six runs crushed over square-leg  length in the slot , hardik sits deep as always and gets under it to launch it over square-leg","cummins to hardik pandya , six , we have seen some massive pick-up shots today and here  one more  straighter line trying to cramp hardik but he  waiting with his front leg out of the way , whips it with a strong bottom hand and sends it over deep-mid-wicket"
16.6,1,"hazlewood to hardik ,  1 run 1 run good length , he sits deep and pulls it to deep midwicket","hazlewood to hardik pandya , 1 run , off-pace delivery and hardik waits to pull it to deep-mid-wicket , settles with a single and retains strike"
16.5,4,"hazlewood to hardik , four runs four runs drilled straight  low full toss and he hits a bullet through hazlewood  legs and it races to the rope","hazlewood to hardik pandya , four , ufff  that  drilled straight down the ground and hardik does not even bother to run  low full toss and he brings the bottom hand into play , whip drives it past hazlewood and the ball races to the fence"
16.4,•,"hazlewood to hardik , no run no run yorker on middle , he gets in a tangle but digs it out well","hazlewood to hardik pandya , no run , right in the blockhole , hardik jams it onto the pad and the ball rolls back to hazlewood"
16.3,4,"hazlewood to hardik , four runs four runs thick-edge off the toe to third  third is up  it was a wide full length , he threw the bat at it and gets it off the toe and it runs away","hazlewood to hardik pandya , four , streaky once again but hardik won't mind it  very full delivery and hardik went chasing outside-off , it was so far that he toe-ended the drive to the right of short-third-man"
16.2,1,"hazlewood to karthik ,  1 run 1 run 137kph , good length fourth stump , he opens the bat face and glides to deep-third","hazlewood to karthik , 1 run , good around off , karthik is happy to open the face and run it down to third-man"
16.2,1,"hazlewood to karthik ,  1 run 1 run 137kph , good length fourth stump , he opens the bat face and glides to deep-third","hazlewood to karthik , wide , strays down leg , karthik gets inside the line and fails to connect with the glance , wide called"
16.2,1w,"hazlewood to karthik , 1 wide 1 wide angled down leg and called wide","hazlewood to karthik , 1 run , good around off , karthik is happy to open the face and run it down to third-man"
16.2,1w,"hazlewood to karthik , 1 wide 1 wide angled down leg and called wide","hazlewood to karthik , wide , strays down leg , karthik gets inside the line and fails to connect with the glance , wide called"
16.1,1,"hazlewood to hardik ,  1 run 1 run 137kph , top of middle , he whips this nicely to deep midwicket but only gets one","hazlewood to hardik pandya , 1 run , hard length and right at the body , hardik flicks it to deep-mid-wicket and settles with a single"
15.6,2,"ellis to karthik ,  2 runs 2 runs 130kph , full and slanting into leg , he tucks this neatly behind square into the gap for two","nathan ellis to karthik , 2 runs , full delivery angled into the pads , karthik flicks it behind square on the leg-side and gets off the mark with a brace"
15.5,W,"ellis to axar patel , out out slower ball forces the error  holes out to long-off  brilliant bowling  back of the hand slower ball wide of off , axar tries to loft over cover but miscues and skies it high to long-off  easy catch for green see all photos","nathan ellis to axar , out caught by green   ellis has been superb today  second wicket for him and he has taken a couple of catches as well  the back of the hand slower ball completely outfoxing axar who didn't pick it and wanted to loft over the cover region , miscues it towards long-off and green makes no mistake  india won't mind this wicket as it brings their designated finisher to the crease  axar c green b nathan ellis 6 5  [4s-1]"
15.4,1,"ellis to hardik ,  1 run 1 run 125kph slower bouncer , he adjusts late and knocks this down to short third","nathan ellis to hardik pandya , 1 run , now a slower ball dug into the surface , hardik waits and dabs it to short-third-man"
15.3,•,"ellis to hardik , no run no run good , 132kph , fourth stump , he  cramped pushing this back to the bowler","nathan ellis to hardik pandya , no run , good and no room on off , hardik knocks it back to ellis and is livid not to have at least got a single"
15.2,•,"ellis to hardik , no run no run slower ball outside-off , he gets a thick-edge along the ground and wade dives to stop it","nathan ellis to hardik pandya , no run , off-pace delivery and hardik did not pick it , he  through the drive early and the outside-edge rolls to the right of wade"
15.1,4,"ellis to hardik , four runs four runs guided fine of short third with and open face  wide worker with third up in the ring , he opens the face , gets a thick-edge but it was the intention","nathan ellis to hardik pandya , four , not sure it was intentional but hardik won't mind the final result  yorker outside-off , he toe-ends the drive and the ball races past inglis near short-third-man"
14.6,1,"cummins to hardik ,  1 run 1 run wide low full toss , sliced to deep backward-point","cummins to hardik pandya , 1 run , low full toss outside-off , hardik opens the bat face and slices the drive to deep backward-point"
14.5,4,"cummins to hardik , four runs four runs carved over cover-point  incredible power  shorter length , he  cramped but he stands up and slaps this with extraordinary power forward of point","cummins to hardik pandya , four , smashed  slower short of length delivery and hardik does not have much room to free his arms , but he still manages to slap it over the extra-cover region and the ball travels quickly to the fence"
14.4,•,"cummins to hardik , no run no run bouncer , over leg , tight call but not called wide on line or height","cummins to hardik pandya , no run , bouncer angled down leg , hardik gets inside the line and tries to swat it away , misses and umpire signals one for the over  cummins got away with that as it was clearly outside leg"
14.3,1,"cummins to axar patel ,  1 run 1 run 111kph , slower ball wide of off , he cuts to deep-point","cummins to axar , 1 run , slower and fraction short , axar waits and cuts it in front of square to sweeper cover"
14.2,4,"cummins to axar patel , four runs four runs sensational straight-drive  on the up  overpitched and he leans on a classic straight-drive","cummins to axar , four , shot  axar can bat mind you and he just shows his class  nothing much wrong with the delivery - fuller and close to off , axar drives on the rise and straight back past hardik  no need to run for that"
14.1,•,"cummins to axar patel , no run no run good length , 136kph , fourth stump , he mistimes a drive to midwicket","cummins to axar , no run , fuller and angled across , axar drives but inside halves it to mid-wicket"
13.6,•,"green to hardik , no run no run 139kph , yorker outside-off , he digs this out to cover","green to hardik pandya , no run , nails the yorker around outside-off , hardik digs it out to cover"
13.5,4,"green to hardik , four runs four runs hammered forward of point  short and wide and he crunches this with power well infront of the sweeper who is behind point see all photos","green to hardik pandya , four , not off the middle but in the gap , the outfield does the rest  width on offer and hardik chops the cut in front of square past cover , no chance for the sweeper to get across and stop that"
13.4,1,"green to axar patel ,  1 run 1 run good , fourth stump , he stands up and forces this to deep-point","green to axar , 1 run , short of length close to off , axar rides the bounce and punches it to sweeper cover"
13.3,W,"green to suryakumar , out out caught behind  extra bounce  good in the test match channel , surya tried to guide to deep-third but gets a thin-edge through to wade","green to suryakumar yadav , out caught by wade   massive wicket  suryakumar was starting to up the tempo and he departs attempting a cheeky shot  short of length delivery and around off , he wanted to run it down to third-man but it was too close to him , only manages an outside-edge and the ball carries nicely to wade  suryakumar yadav c wade b green 46 25  [4s-2 6s-4]"
13.2,1,"green to hardik ,  1 run 1 run top edge flies to fine-leg but just short of hazlewood  extra pace and bounce from green and he was lucky the attempted pull didn't reach fine-leg","green to hardik pandya , 1 run , banged in halfway down , hardik takes it on and goes for the pull , the top-edge lands near fine-leg where hazlewood is happy to take it on the bounce  maybe he could have gone for the catch?"
13.1,6,"green to hardik ,  six runs six runs clubbed over midwicket  length ball , top of middle , he sits deep and smashes this high over midwicket","green to hardik pandya , six , make it three in a row  australia  5th bowler has to bowl couple more and hardik wants to target him  good delivery and hardik was waiting for it , short-arm jabs it over deep-mid-wicket  the amount of power he generated on that shot is ridiculous"
12.6,6,"zampa to suryakumar ,  six runs six runs and again  deep midwicket this time  zampa is furious with himself  again a delivery in the slot , he was down on one knee to send it to the moon over deep midwicket","zampa to suryakumar yadav , six , and again  zampa continues dishing out length , and sky continues going down on it and tonking it even deeper , even higher"
12.5,6,"zampa to suryakumar ,  six runs six runs launched over long-on  84kph but a step hit  wrong length from zampa , he cleared the front leg and smashed it over long-on who watched it sail into the stands","zampa to suryakumar yadav , six , slot ball  a rare loose delivery this from zampa in this spell , and surya piles on , with a swinging full-blooded slog , over long-on"
12.4,1,"zampa to hardik ,  1 run 1 run tossed high on off , 88kph , he drives to long-off","zampa to hardik pandya , 1 run , very loopy , and dipping in the blockhole  pandya unwinds from deep in the crease , and whips it to long-off"
12.3,1,"zampa to suryakumar ,  1 run 1 run 96kph , fired into leg , he whips to deep midwicket","zampa to suryakumar yadav , 1 run , full , leg-lined , surya bottom-hands it to deep-mid-wicket"
12.2,1,"zampa to hardik ,  1 run 1 run tossed up on off , 88kph , he drives to long-off","zampa to hardik pandya , 1 run , full , on off , pushed off the front foot , through the covers"
12.1,1,"zampa to suryakumar ,  1 run 1 run 92kph , leg break drifting into leg , he glances to short fine","zampa to suryakumar yadav , 1 run , drifting in on leg-stump  sky walks , flicks , along the ground , to deep-mid-wicket"
11.6,•,"hazlewood to hardik , no run no run good on off , he  cramped , cutting to backward-point","hazlewood to hardik pandya , no run , massive in-jagger , and it has pandya hopping as he stabs it from nearly his stomach-line to point"
11.5,W,"hazlewood to rahul , out out straight to deep-square  angled into leg , he tries to pick this up off the pads and deposit over deep-square but can't get the elevation or the length and ellis takes the catch easily on the rope","hazlewood to rahul , out caught by nathan ellis   whips it off his legs , and whips it uppishly , but in the process holes out to deep-square-leg  rahul seemed to lose his shape a bit after the drinks break , and this him losing it again , going too hard , without finding the middle  it was the knuckle ball from hazlewood and hence rahul could not get the power behind the shot  rahul c nathan ellis b hazlewood 55 35  [4s-4 6s-3]"
11.4,4,"hazlewood to rahul , four runs four runs nearly holes out but maxwell can't get there  this was smeared flat to wide long-on , maxwell dives full length to try and take it and it half volleys short of him and gets through him for four","hazlewood to rahul , four , nearly holed out  maxwell does stunningly at long-on , going for the catch after running to his right , but the ball dies right in front of him , and bounces past his hands to trickle away into the boundary  kl had a heave at this , which was nowhere off the middle"
11.3,1,"hazlewood to suryakumar ,  1 run 1 run drives and gets a thick inside-edge that runs to deep-square-leg","hazlewood to suryakumar yadav , 1 run , looks to drive , but gets a big inside-edge running away to deep-square-leg"
11.2,6,"hazlewood to suryakumar ,  six runs six runs clipped over midwicket  so sweet from sky  angled into middle and leg and he just picks this up with ease and clears the rope","hazlewood to suryakumar yadav , six , the typical walking-wristy-sky-flick  he  making it look super easy  134kph , angling in , and he walks across with a flamingo-like-flourish to send it over deep-mid-wicket"
11.1,1,"hazlewood to rahul ,  1 run 1 run 134kph good on middle , he stands tall and punches this to long-on","hazlewood to rahul , 1 run , 134kph , jags back in off a good , punched down to long-on off the back foot"
10.6,1,"zampa to rahul ,  1 run 1 run tossed up on off , he drives to long-off , 50 off 32 for rahul  he  played beautifully and gets a great ovation see all photos","zampa to rahul , 1 run , pitched up , and stroked watchfully through extra-cover now  rahul has his fifty , and he seems to have found the template "
10.5,•,"zampa to rahul , no run no run slower , 82kph , leg break , well bowled , he defends off a thick inside-edge as he was deceived","zampa to rahul , no run , tries tentatively pushing it towards cover for his fifty , but the ball spins in , and takes his inside-edge"
10.4,1,"zampa to suryakumar ,  1 run 1 run advances and yorks himself , driving to long-on","zampa to suryakumar yadav , 1 run , charges , hoicks , and toe-ends it to long-on"
10.3,1,"zampa to rahul ,  1 run 1 run 95kph slid through on off , he gives room to cut to deep-point","zampa to rahul , 1 run , sharp slider this: coming in off a length , quickly on middle  rahul gets hurried on as he chops this to deep sweeper"
10.2,1,"zampa to suryakumar ,  1 run 1 run 88kph , flatter in middle , he heaves a slog sweep along the deck to deep midwicket","zampa to suryakumar yadav , 1 run , a massive slog-sweep , a bigger miscue as he drags this through square-leg off the inside-half"
10.1,1,"zampa to rahul ,  1 run 1 run drifting into leg , he advances and digs out a drive to long-on","zampa to rahul , 1 run , dances out , yorks himself in the process , and digs it to long-on"
9.6,1,"ellis to rahul ,  1 run 1 run on-pace short ball leg-stump , punched to wide long-on off the back foot","nathan ellis to rahul , 1 run , 137kph , a neat over this -- tight , good length , angling in , punched through mid-wicket"
9.5,1,"ellis to suryakumar ,  1 run 1 run suspect another slower ball on the hips , hauled away to long-leg","nathan ellis to suryakumar yadav , 1 run , another slower one , off a good  sky waits , clears out his front leg again , and heaves it to fine-leg"
9.4,•,"ellis to suryakumar , no run no run slower bouncer outside-off , surya is early into the ramp and is beaten by the lack of pace","nathan ellis to suryakumar yadav , no run , a neat foxing slower bouncer  113kph , and yadav jumps , tries upper-cutting , and is beaten"
9.3,2,"ellis to suryakumar ,  2 runs 2 runs short of a length and outside-off , slashed away to sweeper cover  they take on hazlewood  arm for the second","nathan ellis to suryakumar yadav , 2 runs , 135 1kph , shuffles across , stands with a very open stance , and cuts it behind point to pinch another two before sweeper cleans up"
9.3,2,"ellis to suryakumar ,  2 runs 2 runs short of a length and outside-off , slashed away to sweeper cover  they take on hazlewood  arm for the second","nathan ellis to suryakumar yadav , wide , 135kph , loses his wrist , and loses his line with an attempted yorker that ends up well down leg"
9.3,1w,"ellis to suryakumar , 1 wide 1 wide low full-toss , sliding down the leg-side for wide","nathan ellis to suryakumar yadav , 2 runs , 135 1kph , shuffles across , stands with a very open stance , and cuts it behind point to pinch another two before sweeper cleans up"
9.3,1w,"ellis to suryakumar , 1 wide 1 wide low full-toss , sliding down the leg-side for wide","nathan ellis to suryakumar yadav , wide , 135kph , loses his wrist , and loses his line with an attempted yorker that ends up well down leg"
9.2,1,"ellis to rahul ,  1 run 1 run good and ducks back in to cramp rahul who hastily stabs a single to the covers","nathan ellis to rahul , 1 run , 132 5kph , jags back in sharply , and rahul awkwardly jabs it into the covers"
9.1,1,"ellis to suryakumar ,  1 run 1 run full and angling into middle and leg , surya shows full face of the bat and drives to long-on","nathan ellis to suryakumar yadav , 1 run , a straight-batted push , straight down the ground"
8.6,6,"maxwell to rahul ,  six runs six runs slog-swept into the stands beyond square-leg for six  much fuller and angling across off , rahul sinks to one knee and unleashes a big slog-sweep  bam ","maxwell to rahul , six , okay , he  received this new indian template , loud and clear  he goes one-kneed , gets under the length , and slogs it flat over deep-mid-wicket"
8.5,•,"maxwell to rahul , no run no run shorter and much closer to off stump , jabbed back to maxwell","maxwell to rahul , no run , spins back in a touch , bounces extra as well , hitting the upper half of rahul  bat as he tries cutting"
8.4,1,"maxwell to suryakumar ,  1 run 1 run shorter and angling across off , flashed to sweeper cover once again","maxwell to suryakumar yadav , 1 run , short again , but angles across and gives him width , which he cuts wide of sweeper"
8.3,1,"maxwell to rahul ,  1 run 1 run hauled away to deep midwicket off the back foot","maxwell to rahul , 1 run , shorter , pulled hard , but is straight to deep-mid-wicket"
8.2,1,"maxwell to suryakumar ,  1 run 1 run whipped away from a middle-stump line through square-leg for one more","maxwell to suryakumar yadav , 1 run , fuller , more on middle , and whipped round the corner"
8.1,1,"maxwell to rahul ,  1 run 1 run short and angling across off stump , slashed away off the back foot to sweeper cover","maxwell to rahul , 1 run , flat , angling across from round the wicket  slapped to deep-point"
7.6,1,"green to rahul ,  1 run 1 run outside-off yorker , good comeback from cam green  dug out in front of square on the off-side for one","green to rahul , 1 run , 138kph , yorker , on off , dug out into the off-side , just next to the pitch , and yadav calls him through for a quick one"
7.5,4,"green to rahul , four runs four runs overpitched once again , but the line is outside-off  rahul latches onto the width and carts it over extra-cover for back-to-back fours see all photos","green to rahul , four , 124 3kph , oh better  green tries an off-cutter of sorts , which rahul picks up early again , and carves over the cover infield , into a large empty gap thereafter"
