ball,score,commentary,second_commentary
7.4,6,"green to rahul ,  six runs six runs overpitched and on the pads , green cops punishment  rahul picks it up and deposits it over square-leg boundary with another whirl of those wrists","green to rahul , six , strays onto the pads , and rahul crouches under it , has a whippy swipe , and sends it 92 meters over backward-square-leg"
7.3,•,"green to rahul , no run no run good and just a shade outside-off , late-cut to point on the back foot","green to rahul , no run , 123 1kph , tight just outside-off , and kl gets cramped as he chops , and finds backward-point"
7.2,1,"green to suryakumar ,  1 run 1 run green bangs it on a heavy length on top of off , surya punches a single down to long-on","green to suryakumar yadav , 1 run , 135kph , an on-punch off the back foot , to mid-on"
7.1,1,"green to rahul ,  1 run 1 run short at the body , rides the bounce and glances a single to fine-leg","green to rahul , 1 run , a hopping glance , off the hips , fine-leg"
6.6,1,"zampa to rahul ,  1 run 1 run looped up outside-off , belted past zampa but long-off has it covered","zampa to rahul , 1 run , hammered straight down the pitch , past the bowler , but long-off is pretty straight and has it covered"
6.5,1,"zampa to suryakumar ,  1 run 1 run eased down to long-off","zampa to suryakumar yadav , 1 run , a much more quieter drive this time around , down to long-off"
6.4,4,"zampa to suryakumar , four runs four runs shovelled away between wide long-on and deep midwicket  not sure if this was the wrong'un , sliding into middle and leg , whipped away","zampa to suryakumar yadav , four , all swag , no sweat  surya , as if it is all very normal , whips this with a full flourish from middle-stump , against the spin , through mid-wicket"
6.3,1,"zampa to rahul ,  1 run 1 run rahul collapses his back leg and drives a full ball on middle through extra-cover","zampa to rahul , 1 run , flight , full , drifting in on middle  rahul clears out his front leg and pushes it quietly through the covers after leaning in"
6.3,1,"zampa to rahul ,  1 run 1 run rahul collapses his back leg and drives a full ball on middle through extra-cover","zampa to rahul , wide , the slider , quick , flat , going down leg  rahul swipes , but the ball skids under"
6.3,1w,"zampa to rahul , 1 wide 1 wide fired down the leg-side for a wide","zampa to rahul , 1 run , flight , full , drifting in on middle  rahul clears out his front leg and pushes it quietly through the covers after leaning in"
6.3,1w,"zampa to rahul , 1 wide 1 wide fired down the leg-side for a wide","zampa to rahul , wide , the slider , quick , flat , going down leg  rahul swipes , but the ball skids under"
6.2,1,"zampa to suryakumar ,  1 run 1 run darted outside-off , slashed away to backward-point , where green , i think , puts in a sprawling save","zampa to suryakumar yadav , 1 run , googly , but wide outside-off and pretty short too  stabbed to a diving backward-point in the ring"
6.1,1,"zampa to rahul ,  1 run 1 run flighted outside-off and breaks away , rahul has a crack at it and slices it away towards sweeper cover","zampa to rahul , 1 run , a loopy wide toss up , carved to deep-point"
5.6,•,"cummins to suryakumar , no run no run cummins shifts to a fuller length and targets the stumps , pushed to mid-off","cummins to suryakumar yadav , no run , fuller , on off , crisply punched off the front foot to mid-off"
5.5,6,"cummins to suryakumar ,  six runs six runs this is even better from surya  short and outside-off , surya reads the length so very quickly and swats it over backward-square-leg in grand style","cummins to suryakumar yadav , six , wow , wow  135kph , and suryakumar  read cummins  mind here , knowing he'd go a bit short , to walk inside the line premeditatedly , and swat it uppishly over fine-leg"
5.4,•,"cummins to suryakumar , no run no run cummins drags his length back and aims for the top of off , surya pats it to mid-off","cummins to suryakumar yadav , no run , 137 3kph , length , on off , but the ball sticks a bit in the pitch as surya checks his push to cover"
5.3,4,"cummins to suryakumar , four runs four runs regal shot from surya  slightly overpitched and outside-off , punchily driven between mid-off and covers with a high elbow see all photos","cummins to suryakumar yadav , four , 137 7kph , slight width , fractionally overcooked , and yadav walks right beside the line to flow with a full-faced stunning cover-drive"
5.2,•,"cummins to suryakumar , no run no run on a length and largely holds its line outside-off , surya gets forward and drives to mid-off","cummins to suryakumar yadav , no run , on a length , just outside-off , punched off the inside-half to mid-off"
5.1,1,"cummins to rahul ,  1 run 1 run full at the stumps , push-driven to mid-on for an urgent single","cummins to rahul , 1 run , pretty full , flicked off the toe-end , wide of mid-on"
4.6,•,"ellis to suryakumar , no run no run surya stands tall to this short ball on a fourth-stump line and punches it back to him  good start from ellis","nathan ellis to suryakumar yadav , no run , 134 5kph , good , tummy-lined  yadav gets behind it and punches it off a straight bat , back to the bowler"
4.5,W,"ellis to kohli , out out ellis takes out kohli in his first over  on the fuller side of a good length and angling into off stump , kohli aims to shovel it over mid-on with his bottom hand but does not get enough elevation  straightforward catch for cam green in the infield see all photos","nathan ellis to kohli , out caught by green   he  been cut short  a seven ball stay , and a pretty scratchy one at that , with the aussies really bowling well here to keep kohli quiet  and so , he looks to whip this full delivery uppishly , but alas , it  too full , and he just doesn't get under the length , ending up skewing it tamely to mid-on  the 2016 madness isn't happening tonight    kohli c green b nathan ellis 2 7 "
4.4,1,"ellis to rahul ,  1 run 1 run pretty full leg-stump , whisked away straight of mid-on for a single","nathan ellis to rahul , 1 run , 136 3kph , good length , on middle , nudged softly back down the ground"
4.3,2,"ellis to rahul ,  2 runs 2 runs good and outside-off , slapped away behind point off an open face","nathan ellis to rahul , 2 runs , 136 1kph , neat stab this , opening his bat face and guiding this past a diving point"
4.2,1,"ellis to kohli ,  1 run 1 run slower ball on a hard length and moves away like a legcutter  kohli checks his shot and dabs it to deep-third","nathan ellis to kohli , 1 run , a slower good delivery  109kph  kohli waits , hangs back , and dabs it to third-man"
4.2,1,"ellis to kohli ,  1 run 1 run slower ball on a hard length and moves away like a legcutter  kohli checks his shot and dabs it to deep-third","nathan ellis to kohli , wide , angles in , and slips down leg  kohli will feel he  missed out here"
4.2,1w,"ellis to kohli , 1 wide 1 wide full and angling down the leg-side , wide called  re-set the radar , nathan","nathan ellis to kohli , 1 run , a slower good delivery  109kph  kohli waits , hangs back , and dabs it to third-man"
4.2,1w,"ellis to kohli , 1 wide 1 wide full and angling down the leg-side , wide called  re-set the radar , nathan","nathan ellis to kohli , wide , angles in , and slips down leg  kohli will feel he  missed out here"
4.1,•,"ellis to kohli , no run no run on a length and outside-off , pushed into the covers","nathan ellis to kohli , no run , length , outside-off , checked defensive push"
3.6,4,"zampa to rahul , four runs four runs tossed up on middle and breaks away , rahul decides to take this on as well  he tries to go over mid-off or cover , ends up slicing it squarer over point for four","zampa to rahul , four , streaky , but effective enough to ruin zampa  over here  a tossed up delivery , which rahul looks to go inside-out against , and ends up with the outside-edge slicing over point"
3.5,•,"zampa to rahul , no run no run rahul backs away outside leg , zampa chases him with a slider , which is flashed to cover-point","zampa to rahul , no run , makes room to try and go through the off-side infield , but drills it straight to cover"
3.4,1,"zampa to kohli ,  1 run 1 run lobbed up on the stumps , mighty full  kohli can't get under it  jammed out to mid-on","zampa to kohli , 1 run , very full again as it drifts in on middle-stump , just not letting kohli get under  squeezed into the leg-side"
3.3,•,"zampa to kohli , no run no run good and outside-off , kohli jabs it out","zampa to kohli , no run , near yorker , and kohli - despite a big bottom-handed whip - can only dig it out"
3.2,•,"zampa to kohli , no run no run shortish and outside-off , kohli goes on the back foot and punches it more or less straight to point","zampa to kohli , no run , flat , tight , on the stumps  a cramped punch off the back foot to cover"
3.1,•,"zampa to kohli , no run no run sliding into the pads as kohli does not meet with a flick","zampa to kohli , no run , leans forward to try and get a feel of the ball , but the ball slides on , going past the flick"
2.6,•,"hazlewood to rahul , no run no run shorter and swerves away outside-off with some extra bounce  rahul stabs away from the body and gets away with it as the ball misses the outside-edge","hazlewood to rahul , no run , a bit of a kick up off the deck , whizzing just over rahul  loose stab away from his body"
2.5,4,"hazlewood to rahul , four runs four runs full and nips away outside-off , rahul eyes up the leg-side and gets a leading edge that flies past the keeper  zampa at deep-third fumbles and gives up four  lax work in the deep","hazlewood to rahul , four , now , now  a rare aussie misfield , and zampa  the culprit , after the ball goes down to him at third-man off rahul  leading-edge , only to mess up"
2.4,W,"hazlewood to rohit sharma , out out ellis runs in from deep-square-leg and grabs a terrific , low catch  fuller and on off stump , rohit aims to pick it up and send it over the leg-side  skews it in the air  ellis covers a lot of ground , attacks the ball , and takes it see all photos","hazlewood to rohit , out caught by nathan ellis   a little too casually flicked this  rohit doesn't commit fully , as he looks to whip this good length delivery on outside-off uppishly over deep-mid-wicket  and thus , he ends up with a toe-end , getting dragged and dying in front of deep-square-leg , where ellis does really well to run in , slide under the ball , and keep his fingers under  rohit c nathan ellis b hazlewood 11 9  [4s-1 6s-1]"
2.3,1,"hazlewood to rahul ,  1 run 1 run shortish and leg-stump , rahul flicks it out to deep midwicket for one","hazlewood to rahul , 1 run , 140 1kph , sliding into the legs , quietly flicked to deep-mid-wicket"
2.2,•,"hazlewood to rahul , no run no run rahul manufactures room and shimmies out once again  hazlewood digs it short and gets it to shape away outside-off to beat the swinging bat","hazlewood to rahul , no run , 140 4kph , walks out again , and hazlewood bumps in a good delivery , going well over the swinging bat"
2.1,6,"hazlewood to rahul ,  six runs six runs rahul gets into the act now and launches hazlewood over square-leg for six  he shimmies out , picks up a shortish ball outside-off and shovel-pulls it away over great authority","hazlewood to rahul , six , yep , yep  intent alright  kl walks across his stumps , takes a step down the pitch as well , getting under the length and smoking it over cow-corner"
1.6,4,"cummins to rohit sharma , four runs four runs full and wide , rohit dashes out of the crease once again and throws his bat at ball  he carves it over the off-side infield for four  carved away over the cover-point region see all photos","cummins to rohit , four , 140kph , full , wide , and that one rare loose delivery  rohit throws his hands at it , carving over cover-point"
1.5,•,"cummins to rohit sharma , no run no run nice and full , straightens away past the outside-edge as rohit prods at it","cummins to rohit , no run , beats him now  cummins goes back to his fourth-stump spot , and gets it to nip past rohit  tentative defence"
1.4,6,"cummins to rohit sharma ,  six runs six runs clears long-leg for six  overpitched and on the pads , rohit picks it up and whips it over hazlewood for six  hazlewood runs in as opposed to standing back at the boundary and misjudges what could've been a chance","cummins to rohit , six , okay , that  seriously brave  sharma whips again , doesn't get it off the middle , and there  a backward-square-leg as well  just clears him   tell you what , that fielder was around ten yards inside the ropes , and had he been at the edge , he could've had rohit"
1.3,•,"cummins to rohit sharma , no run no run full inswinger from cummins  rohit has a roundhouse swipe at it and wears it on the pad , but this is heading down the leg-side","cummins to rohit , no run , 136 6kph , massive hoick across the line  ugly  ungainly  all he gets is an inside-edge onto his pad"
1.2,•,"cummins to rohit sharma , no run no run on a length and nibbles away outside-off , rohit plays with soft hands and steers it to point off the outer half","cummins to rohit , no run , 135 4kph , again , right on outside-off , and rohit defends off his bat  outside-half towards point"
1.1,•,"cummins to rohit sharma , no run no run good and angling into off , rohit gets right behind the line and plays it back to cummins","cummins to rohit , no run , length , stump-to-stump , accurately on the top of off  sharma shows it some respect"
0.6,•,"hazlewood to rahul , no run no run on a length and just a shade outside-off , rahul throws his bat at a drive and wafts it to mid-on off the inner half","hazlewood to rahul , no run , 141 3kph , presses forward to cover-drive , and ends up inside-halving it to mid-on"
0.5,2,"hazlewood to rahul ,  2 runs 2 runs short of a length and on the hips , clipped away to deep-square-leg","hazlewood to rahul , 2 runs , 137 8kph , a tad straighter , and glanced off the hips through square-leg , to get cut off by a diving fielder from behind square"
0.4,•,"hazlewood to rahul , no run no run terrific delivery from hazlewood  in-between length , threatens to angle in , but leaves rahul in the channel  he hangs his bat inside the line and does not jab at the ball","hazlewood to rahul , no run , 138kph , jaffa this -- seam up , on a length , just outside-off , angling in and seaming away past kl  loose poke"
0.3,1,"hazlewood to rohit sharma ,  1 run 1 run rohit dashes down the track and hacks it away towards mid-on  he sprints across to the other end and gets off the mark","hazlewood to rohit , 1 run , oh , oh  140 3kph , on the stumps  rohit charges out , heaves , and drags it off a miscue straight to mid-on  but he isn't stopping on the single either  a direct-hit would have had him   "
0.2,•,"hazlewood to rohit sharma , no run no run good length , angling in and straightens away , opens up rohit  hazlewood draws a leading edge that drops into the covers","hazlewood to rohit , no run , 137 2kph , tighter , good length , on middle  rohit looks to turn it to leg and closes his bat face early , with the ball then taking the leading-edge to roll away towards point"
0.1,1,"hazlewood to rahul ,  1 run 1 run nice and full , slanting into the pads , tucked away through backward-square-leg see all photos","hazlewood to rahul , 1 run , 138 5kph , a nice juicy , friendly , full delivery angling in leg-stump  and rahul crisply clips it to backward-square-leg"
